Kod,Tanım
41.00.01,İkamet amaçlı binaların inşaatı (ahşap binaların inşaatı hariç)
41.00.02,İkamet amaçlı olmayan binaların inşaatı
41.00.03,Mevcut ikamet amaçlı olan veya ikamet amaçlı olmayan binaların yeniden düzenlenmesi veya yenilenmesi (büyük çaplı revizyon) (tarihi yapıların restorasyonu hariç)
41.00.04,İkamet amaçlı ahşap binaların inşaatı
41.00.05,Prefabrik binalar için bileşenlerin alanda birleştirilmesi ve kurulması
42,Bina dışı yapıların inşaatı
42.1,Kara ve demir yollarının inşaatı
42.11,Kara yolları ve otoyolların inşaatı
42.11.01,"Otoyollar, kara yolları, şehir içi yollar ve diğer araç veya yaya yollarının inşaatı"
42.11.02,"Yol yüzeylerinin asfaltlanması ve onarımı, kaldırım, kasis, bisiklet yolu vb.lerin inşaatı"
42.11.03,Havaalanı pisti inşaatı
42.12,Demir yolları ve metroların inşaatı
42.12.01,Demir yolları ve metroların inşaatı
42.13,Köprüler ve tünellerin inşaatı
42.13.01,Köprülerin inşaatı (yükseltilmiş kara yolları-viyadükler dahil)
42.13.02,Tünel inşaatı
42.2,Hizmet projelerinin inşaatı
42.21,Akışkanlar için hizmet projelerinin inşaatı
42.21.01,Akışkanlar için uzun mesafe boru hatlarının inşaatı (petrol ürünleri ve gaz taşımacılığı ile su ve diğer ürünlerin taşımacılığına yönelik karada ve deniz altında uzun mesafe boru hattı)
42.21.02,"Su kuyusu açma ve septik sistem kurulum faaliyetleri (kuyu, artezyen vb.)"
42.21.03,"Ana su şebekeleri ve su hatları ile su arıtma tesisleri, kanalizasyon bertaraf tesisleri ve pompa istasyonları inşaatı (sulama sistemleri (kanallar) dahil)"
42.21.05,"Akışkanlar için kısa mesafe (yerel) boru hatlarının inşaatı (petrol ürünleri ve gaz taşımacılığı ile su, kanalizasyon, sıcak su, buhar ve diğer ürünlerin taşımacılığına yönelik kısa mesafe boru hattı)"
42.22,Elektrik ve telekomünikasyon için hizmet projelerinin inşaatı
42.22.01,Uzun mesafe elektrik hatlarının inşaatı (uzun mesafe yüksek gerilim elektrik iletim hatları ile uzun mesafe yer üstü/altı veya deniz altı iletim hatları)
42.22.02,"Enerji santralleri inşaatı (hidroelektrik santrali, termik santral, güneş ve rüzgar santrali, nükleer enerji üretim santralleri vb.)"
42.22.04,Kentsel (kısa mesafe) elektrik hatlarının inşaatı (trafo istasyonları ve yerel sınırlar içerisindeki dağıtım alt istasyonları vb.)
42.22.05,Telekomünikasyon şebeke ve ağlarının bakım ve onarımı
42.22.06,Uzun mesafe telekomünikasyon (iletişim) hatlarının inşaatı
42.22.07,Kentsel (kısa mesafe) telekomünikasyon (iletişim) hatlarının inşaatı
42.9,Bina dışı diğer yapılara ait projelerin inşaatı
42.91,Su projeleri inşaatı
42.91.01,"Kıyı ve liman inşaatları ve ilgili hidromekanik yapıların inşaatı (su yolları, kanal vb. dahil)"
42.91.02,"Su ve su zemininin taranması ve temizlenmesi (deniz, nehir, göl vb.)"
42.91.03,"Tersane, dok ve kanal havuzu inşaatı (gemi inşaatı ve tamiri için)"
42.91.04,Baraj ve bentlerin inşaatı
42.99,Başka yerde sınıflandırılmamış bina dışı diğer yapılara ait projelerin inşaatı
42.99.01,Açık havada yapılan sporlara uygun tesislerin ve eğlence alanları yapılarının inşaatı
42.99.02,Madencilik ve imalat sanayisi yapılarının inşaatı
42.99.04,Doğalgaz işleme tesisleri inşaatı
42.99.05,Yüzme havuzlarının inşaatı (prefabrik olanlar hariç)
42.99.99,"Başka yerde sınıflandırılmamış bina dışı diğer yapıların inşaatı (arazi iyileştirilmesi ile birlikte arazinin parsellemesi dahil, iyileştirme yapılmaksızın parselleme hariç)"
43,Özel inşaat faaliyetleri
43.1,Yıkım ve şantiyenin hazırlanması
43.11,Yıkım işleri (binaların ve diğer yapıların yıkılması ve sökülmesi)
43.11.01,Yıkım işleri (binaların ve diğer yapıların yıkılması ve sökülmesi)
43.12,Şantiyenin hazırlanması
43.12.01,"Zemin ve arazi hazırlama, alanın temizlenmesi ile kazı ve hafriyat işleri (madencilik için yapılanlar hariç)"
43.12.02,"Maden sahalarının hazırlanması (tünel açma dahil, petrol ve gaz sahaları için olanlar hariç)"
43.13,Test sondajı ve delme
43.13.01,Test sondajı ve delme (madencilikle bağlantılı olarak gerçekleştirilen test sondajı hariç)
43.2,"Elektrik tesisatı, sıhhi tesisat ve diğer inşaat tesisatı faaliyetleri"
43.21,Elektrik tesisatı
43.21.01,"Bina ve bina dışı yapıların (ulaşım için aydınlatma ve sinyalizasyon sistemleri hariç) elektrik tesisatı, kablolu televizyon ve bilgisayar ağı tesisatı ile konut tipi antenler (uydu antenleri dahil), elektrikli güneş enerjisi kollektörleri, elektrik sayaçları, elektrikli araçlar için elektrikli şarj cihazları tesisatının kurulumu, duvar dibi ısıtma sistemleri, yangın ve hırsızlık alarm sistemleri vb. kurulumu"
43.21.03,"Kara yolları, demir yolları ve diğer raylı yolların, liman ve havaalanlarının aydınlatma ve sinyalizasyon sistemlerinin tesisatı (havaalanı pisti aydınlatmasının tesisatı dahil)"
43.22,"Sıhhi tesisat, ısıtma ve iklimlendirme tesisatı"
43.22.03,Bina ve diğer inşaat projelerinde su ve kanalizasyon tesisatı ve onarımı
43.22.05,Gaz tesisatı faaliyetleri (hastanelerdeki oksijen gazı temini için kurulum işleri dahil)
43.22.06,"Bina veya diğer inşaat projelerinde ısıtma, havalandırma, soğutma ve iklimlendirme sistemlerinin onarım ve bakımı"
43.22.07,"Bina veya diğer inşaat projelerinde ısıtma, havalandırma, soğutma ve iklimlendirme sistemlerinin kurulumu"
43.23,Yalıtım tesisatı
43.23.01,Yalıtım tesisatı (su yalıtımı ile çatıların dış yalıtımı hariç)
43.23.02,Su yalıtımı (çatıların su yalıtımı hariç)
43.24,Diğer inşaat tesisatı
43.24.01,"Asansörlerin, yürüyen merdivenlerin, yürüyen yolların, otomatik ve döner kapıların onarım ve bakımı dahil kurulum işleri"
43.24.02,"Isı, ses veya titreşim yalıtımı ile diğer inşaat tesisatı işleri (mantolama ve vakumlu temizleme sistemlerinin kurulumu dahil)"
43.24.03,Parmaklık ve korkuluk tesisatı işleri (metal yangın merdivenlerinin kurulumu dahil)
43.24.99,Başka yerde sınıflandırılmamış diğer tesisat işleri
43.3,Binanın tamamlanması ve bitirilmesi
43.31,Sıva işleri
43.31.01,Sıva işleri
43.32,Doğrama tesisatı
43.32.01,"Hazır mutfaklar, mutfak tezgahları, gömme dolaplar, iç merdivenler ile ince tahta, lambri ve benzerlerinin montajı işleri"
43.32.02,"Herhangi bir malzemeden yapılan kapı ve pencere kasaları, kapılar (zırhlı kapılar dahil, otomatik ve döner kapılar hariç), pencereler, kepenkler, panjurlar, garaj kapıları ve benzerlerinin montajı"
43.32.03,Seyyar bölme ve metal yapı üzerine asma tavan montaj işleri ile diğer doğrama tesisatı işleri
43.33,Yer ve duvar kaplama
43.33.01,"Bina ve diğer yapıların içi veya dışında yer ve duvar kaplama faaliyetleri (halı, taban muşambası ve kağıt kaplama hariç)"
43.33.99,"Başka yerde sınıflandırılmamış diğer yer döşeme ve kaplama ile duvar kaplama işleri (halı, taban muşambası ve diğer esnek yer kaplamaları ile duvar kaplama işleri)"
43.34,Boya ve cam işleri
43.34.01,Binaların iç ve dış boyama işleri
43.34.02,Cam takma işleri
43.34.03,Bina dışı yapıların boyama işleri
43.35,İnşaatlardaki diğer bütünleyici ve tamamlayıcı işler
43.35.00,İnşaatlardaki diğer bütünleyici ve tamamlayıcı işler
43.4,Binaların inşası alanında özelleşmiş inşaat faaliyetleri
43.41,Çatı işleri
43.41.00,Çatı işleri
43.42,Bina inşaatlarındaki diğer özel inşaat faaliyetleri
43.42.01,Yapısal çelik bileşenlerin kurulması işleri (bina inşaatları için)
43.42.02,Bina inşaatı için kazık çakma ve temel inşaatı işleri (forekazık çakma dahil)
43.42.03,Baca ve sanayi fırınlarının inşaatı ve kurulması (fırınlar için yanma odasına ateş tuğlası döşenmesi işleri dahil)
43.42.99,Bina inşaatlarında başka yerde sınıflandırılmamış diğer inşaat faaliyetleri
43.5,Bina dışı yapılardaki özel inşaat faaliyetleri
43.50,Bina dışı yapılardaki özel inşaat faaliyetleri
43.50.01,Yapısal çelik bileşenlerin kurulması işleri (bina dışı inşaatları için)
43.50.02,Bina dışı yapılar için kazık çakma ve temel inşaatı işleri (forekazık çakma dahil)
43.50.03,Yer altı çalışmaları (su kuyusu açma hariç)
43.50.04,Prefabrik yüzme havuzlarının kurulumu
43.50.05,"Yol yüzeylerin boyayla işaretlenmesi, yol bariyeri, trafik işaret ve levhaları vb.nin kurulumu gibi yol, tünel vb. yerlerdeki yüzey işleri"
43.50.06,"Prefabrik yapıların montajı ve kurulması (prefabrik binalar ve yüzme havuzları hariç her çeşit prefabrik sokak düzeneklerinin (otobüs durağı, telefon kulübesi, bank vb.) kurulumu vb.)"
43.6,Özel inşaat hizmetleri için aracılık hizmeti faaliyetleri
43.60,Özel inşaat hizmetleri için aracılık hizmeti faaliyetleri
43.60.00,Özel inşaat hizmetleri için aracılık hizmeti faaliyetleri
43.9,Diğer özel inşaat faaliyetleri
43.91,"Duvarcılık ve tuğla, briket vb. döşeme faaliyetleri"
43.91.00,"Duvarcılık ve tuğla, briket vb. döşeme faaliyetleri"
43.99,Başka yerde sınıflandırılmamış diğer özel inşaat faaliyetleri
43.99.04,Vinç ve benzeri diğer inşaat ekipmanlarının operatörü ile birlikte kiralanması (özel bir inşaat çeşidinde yer almayan)
43.99.05,İnşaatlarda beton işleri (kalıp içerisine beton dökülmesi vb.)
43.99.07,İnşaat iskelesi ve çalışma platformunu kurma ve sökme işleri
43.99.13,İnşaat demirciliği (inşaat demirinin bükülmesi ve bağlanması)
43.99.99,Başka yerde sınıflandırılmamış diğer uzmanlaşmış inşaat işleri
G,TOPTAN VE PERAKENDE TİCARET
46,Toptan ticaret
46.1,Bir ücret veya sözleşmeye dayalı olarak yapılan toptan ticaret
46.11,"Tarımsal ham maddelerin, canlı hayvanların, tekstil ham maddelerinin ve yarı mamul malların toptan satışı ile ilgili aracıların faaliyetleri"
46.11.01,"Çiçeklerin, bitkilerin, diğer tarımsal hammaddelerin, tekstil hammaddelerinin ve yarı mamul malların bir ücret veya sözleşmeye dayalı olarak toptan satışını yapan aracılar"
46.11.02,Canlı hayvanların bir ücret veya sözleşmeye dayalı olarak toptan satışını yapan aracılar
46.11.90,Diğer malların toptan satışı ile ilgili aracıların faaliyetleri (kürklü müzayedeleri vb.)
46.12,"Yakıtların, maden cevherlerinin, metallerin ve endüstriyel kimyasalların toptan satışı ile ilgili aracıların faaliyetleri"
46.12.01,"Katı, sıvı ve gaz haldeki yakıtların ve ilgili ürünlerin toptan satışı ile ilgili aracıların faaliyetleri (motorlu taşıt yakıtları dahil)"
46.12.02,"Endüstriyel kimyasallar, gübreler ve zirai kimyasal ürünlerin toptan satışı ile ilgili aracıların faaliyetleri"
46.12.03,Birincil formdaki metaller ve metal cevherlerinin toptan satışı ile ilgili aracıların faaliyetleri
46.13,Kereste ve inşaat malzemelerinin toptan satışı ile ilgili aracıların faaliyetleri
46.13.01,İnşaat malzemesi toptan satışı ile ilgili aracıların faaliyetleri (inşaat demiri ve kerestesi hariç)
46.13.02,Kereste ve kereste ürünlerinin toptan satışı ile ilgili aracıların faaliyetleri
46.14,"Makine, sanayi araç ve gereçleri ile deniz ve hava taşıtlarının toptan satışı ile ilgili aracıların faaliyetleri"
46.14.01,"Bilgisayar, yazılım, elektronik ve telekomünikasyon donanımlarının ve diğer büro ekipmanlarının toptan satışı ile ilgili aracıların faaliyetleri"
46.14.02,Tarımsal ekipmalar ile makine ve sanayi ekipmanlarının toptan satışı ile ilgili aracıların faaliyetleri
46.14.03,"Gemilerin, hava taşıtlarının ve diğer taşıma ekipmalanlarının toptan satışı ile ilgili aracıların faaliyetleri"
46.15,"Mobilya, ev eşyaları, hırdavat ve madeni eşyaların toptan satışı ile ilgili aracıların faaliyetleri"
46.15.01,Mobilyaların toptan satışı ile ilgili aracıların faaliyetleri
46.15.02,"Hırdavatçı (nalburiye) eşyalarının, madeni eşyaların ve el aletlerinin toptan satışı ile ilgili aracıların faaliyetleri"
46.15.03,"Radyo, televizyon ve video cihazlarının toptan satışı ile ilgili aracıların faaliyetleri"
46.15.90,Diğer ev eşyalarının toptan satışı ile ilgili aracıların faaliyetleri
46.16,"Tekstil, giysi, kürk, ayakkabı ve deri eşyaların toptan satışı ile ilgili aracıların faaliyetleri"
46.16.01,"Deri giyim eşyası, kürk ve ayakkabının bir ücret veya sözleşmeye dayalı olarak toptan satışını yapan aracılar"
46.16.02,Deri eşyalar ve seyahat aksesuarlarının bir ücret veya sözleşmeye dayalı olarak toptan satışını yapan aracılar
46.16.03,Giyim eşyalarının bir ücret veya sözleşmeye dayalı olarak toptan satışını yapan aracılar (deri giyim eşyaları hariç)
46.16.04,"Tekstil ürünlerinin bir ücret veya sözleşmeye dayalı olarak toptan satışını yapan aracılar (iplik, kumaş, ev tekstili, perde vb. ürünler) (giyim eşyaları hariç)"
46.17,"Gıda, içecek ve tütün toptan satışı ile ilgili aracıların faaliyetleri"
46.17.01,"Gıda maddelerinin toptan satışı ile ilgili aracıların faaliyetleri (aracı üretici birlikleri dahil, içecekler ile yaş sebze ve meyve hariç)"
46.17.02,Yaş sebze ve meyvelerin toptan satışı ile ilgili aracıların faaliyetleri (kabzımallık ve aracı üretici birlikleri dahil)
46.17.03,Tütün ve tütün ürünlerinin toptan satışı ile ilgili aracıların faaliyetleri (aracı üretici birlikleri dahil)
46.17.04,İçeceklerin toptan satışı ile ilgili aracıların faaliyetleri
46.18,Belirli diğer ürünlerin toptan satışı ile ilgili aracıların faaliyetleri
46.18.01,"Oyun ve oyuncak, spor malzemesi, bisiklet, kitap, gazete, dergi, kırtasiye ürünleri, müzik aleti, saat ve mücevher ile fotoğrafçılıkla ilgili ve optik aletlerin toptan satışı ile ilgili aracıların faaliyetleri"
46.18.02,"Kozmetik, parfüm ve bakım ürünleri ile temizlik malzemesinin toptan satışı ile ilgili aracıların faaliyetleri"
46.18.03,"Tıbbi ürünlerin, araç ve malzemelerin toptan satışı ile ilgili aracıların faaliyetleri"
46.18.04,Kağıt ve karton (mukavva) ile ilgili belirli ürünlerin toptan satışı ile ilgili aracıların faaliyetleri
46.18.05,Eczacılıkla ilgili ürünlerin toptan satışı ile ilgili aracıların faaliyetleri
46.18.06,Otomobillerin ve hafif motorlu kara taşıtlarının toptan satışı ile ilgili aracıların faaliyetleri (elektrikli olanlar ile ambulans ve minibüs benzeri motorlu yolcu taşıtları için olanlar dahil)
46.18.07,"Diğer motorlu kara taşıtlarının toptan satışı ile ilgili aracıların faaliyetleri (kamyonlar, çekiciler, römorklar, yarı römorklar, kamp araçları vb., elektrikli olanlar dahil)"
46.18.08,Motorlu kara taşıtlarının parça ve aksesuarlarının toptan satışı ile ilgili aracıların faaliyetleri
46.18.09,"Motosikletler, motorlu bisikletler ve bunların parça ve aksesuarlarının toptan satışı ile ilgili aracıların faaliyetleri"
46.18.99,Başka yerde sınıflandırılmamış belirli diğer ürünlerin toptan satışı ile ilgili aracıların faaliyetleri
46.19,Uzmanlaşmamış toptan ticaret ile ilgili aracıların faaliyetleri
46.19.01,Uzmanlaşmamış toptan ticaret ile ilgili aracıların faaliyetleri
46.2,Tarımsal ham madde ve canlı hayvanların toptan ticareti
46.21,"Tahıl, işlenmemiş tütün, tohum ve hayvan yemi toptan ticareti"
46.21.01,Hayvan yemi toptan ticareti
46.21.02,"Tahıl toptan ticareti (buğday, arpa, çavdar, yulaf, mısır, çeltik vb.)"
46.21.03,Yağlı tohum ve yağlı meyvelerin toptan ticareti
46.21.06,Pamuk toptan ticareti
46.21.07,Yün ve tiftik toptan ticareti
46.21.08,Tohum (yağlı tohumlar hariç) toptan ticareti
46.21.99,Başka yerde sınıflandırılmamış diğer tarımsal ham maddelerin toptan ticareti
46.22,Çiçeklerin ve bitkilerin toptan ticareti
46.22.01,Çiçeklerin ve bitkilerin toptan ticareti
46.23,Canlı hayvanların toptan ticareti
46.23.01,Canlı hayvanların toptan ticareti (kümes hayvanları hariç)
46.23.02,Canlı kümes hayvanları toptan ticareti
46.24,"Ham deri, post ve deri toptan ticareti"
46.24.01,"Ham deri, post ve kürklü deri toptan ticareti"
46.24.02,"Tabaklanmış deri, güderi ve kösele toptan ticareti"
46.3,"Gıda, içecek ve tütün toptan ticareti"
46.31,Meyve ve sebzelerin toptan ticareti
46.31.01,"Fındık, antep fıstığı, yer fıstığı ve ceviz toptan ticareti (kavrulmuş olanlar hariç)"
46.31.02,Taze incir ve üzüm toptan ticareti
46.31.03,Narenciye toptan ticareti
46.31.04,Diğer taze meyve sebze toptan ticareti (patates dahil)
46.31.05,Zeytin (işlenmiş) toptan ticareti
46.31.06,Kültür mantarı toptan ticareti
46.31.08,"Kuru bakliyat ürünleri toptan ticareti (fasulye, mercimek, nohut, vb.)"
46.31.09,"Kavrulmuş veya işlenmiş kuru yemiş toptan ticareti (leblebi, kavrulmuş fındık, fıstık, çekirdek vb.)"
46.31.10,Kuru üzüm toptan ticareti
46.31.11,Kuru incir toptan ticareti
46.31.12,Kuru kayısı toptan ticareti
46.31.90,"Diğer işlenmiş veya korunmuş sebze ve meyve toptan ticareti (reçel, pekmez, pestil, salamura veya turşusu yapılmış olanlar dahil) (fındık, incir, üzüm, narenciye, zeytin, kültür mantarı ve kuru yemiş hariç)"
46.32,Et ve et ürünleri ile balık ve balık ürünlerinin toptan ticareti
46.32.01,Kümes hayvanları ve av hayvanları etlerinin toptan ticareti
46.32.02,Et toptan ticareti (av hayvanları ve kümes hayvanları etleri hariç)
46.32.03,"Yenilebilir sakatat (ciğer, işkembe, böbrek, taşlık vb.) toptan ticareti"
46.32.04,"Et ürünlerinin toptan ticareti (salam, sosis, sucuk, pastırma vb.)"
46.32.05,"Balık, kabuklular, yumuşakçalar ve diğer deniz ürünleri toptan ticareti"
46.33,"Süt ürünleri, yumurta ve yenilebilir sıvı ve katı yağların toptan ticareti"
46.33.01,"Süt ürünleri toptan ticareti (işlenmiş süt, süt tozu, yoğurt, peynir, kaymak, tereyağı vb.)"
46.33.02,Yumurta ve yumurta ürünleri toptan ticareti
46.33.03,Hayvan veya bitkisel kaynaklı yenilebilir sıvı ve katı yağların toptan ticareti (tereyağı hariç)
46.34,İçeceklerin toptan ticareti
46.34.01,Alkollü içeceklerin toptan ticareti
46.34.02,"Meyve ve sebze suları, maden suyu, meşrubat ve diğer alkolsüz içeceklerin toptan ticareti (su hariç)"
46.34.03,"Su toptan ticareti (su istasyonları dahil, şebeke suyu hariç)"
46.35,Tütün ürünlerinin toptan ticareti
46.35.01,Tütün ürünlerinin toptan ticareti (işlenmemiş tütün hariç)
46.36,"Şeker, çikolata ve şekerleme toptan ticareti"
46.36.01,"Çikolata ve şekerleme toptan ticareti (helva, lokum, akide şekeri, bonbon şekeri vb. dahil)"
46.36.02,Fırıncılık mamullerinin toptan ticareti
46.36.03,Şeker toptan ticareti
46.36.04,Dondurma ve diğer yenilebilir buzların toptan ticareti
46.37,"Kahve, çay, kakao ve baharat toptan ticareti"
46.37.01,Çay toptan ticareti
46.37.02,"Kahve, kakao ve baharat toptan ticareti"
46.37.03,İçecek amaçlı kullanılan aromatik bitkilerin toptan ticareti
46.38,Diğer gıda maddelerinin toptan ticareti
46.38.02,Ev hayvanları için yemlerin veya yiyeceklerin toptan ticareti (çiftlik hayvanları için olanlar hariç)
46.38.03,Gıda tuzu (sofra tuzu) toptan ticareti
46.38.04,"Un, nişasta, makarna, şehriye vb. ürünler ile hazır gıdaların toptan ticareti"
46.38.05,Hazır homojenize gıda ile diyetetik gıda ürünleri toptan ticareti
46.38.99,Başka yerde sınıflandırılmamış diğer gıda ürünlerinin toptan ticareti
46.39,"Uzmanlaşmamış gıda, içecek ve tütün toptan ticareti"
46.39.03,"Uzmanlaşmamış gıda, içecek ve tütün toptan ticareti"
46.4,Ev eşyalarının toptan ticareti
46.41,Tekstil ürünlerinin toptan ticareti
46.41.01,"Evde kullanılan tekstil takımları, perdeler ve çeşitli tekstil malzemesinden ev eşyaları toptan ticareti"
46.41.02,Tuhafiye ürünleri toptan ticareti
46.41.03,Kumaş toptan ticareti (manifatura ürünleri dahil)
46.41.04,İplik toptan ticareti (tuhafiye ürünleri ile dikiş ipliği hariç)
46.41.90,Diğer tekstil ürünleri toptan ticareti
46.42,Giysi ve ayakkabı toptan ticareti
46.42.01,"Bebek giysileri, sporcu giysileri ve diğer giyim eşyalarının toptan ticareti"
46.42.02,Ayakkabı toptan ticareti (spor ayakkabıları hariç)
46.42.03,Çorap ve giysi aksesuarlarının toptan ticareti
46.42.04,Kürk ve deriden giyim eşyalarının toptan ticareti
46.42.05,"Dış giyim eşyalarının toptan ticareti (iş giysileri ile triko olanlar dahil, kürk ve deriden olanlar hariç)"
46.42.06,İç giyim eşyalarının toptan ticareti
46.42.07,Şemsiye toptan ticareti (güneş ve bahçe şemsiyeleri hariç)
46.42.08,Ayakkabı malzemeleri toptan ticareti
46.43,Elektrikli ev aletleri toptan ticareti
46.43.01,Beyaz eşya toptan ticareti
46.43.08,Hırsız ve yangın alarmları ile benzeri cihazların toptan ticareti (evlerde kullanım amaçlı)
46.43.09,"Radyo, televizyon, video ve DVD cihazlarının toptan ticareti (antenler ile arabalar için radyo ve TV ekipmanları dahil)"
46.43.10,Fotoğrafçılıkla ilgili ürünlerin toptan ticareti
46.43.11,Optik ürünlerin toptan ticareti
46.43.12,"Konutlarda, bürolarda ve mağazalarda kullanılan klimaların (iklimlendirme ekipmanlarının) toptan ticareti (sanayi tipi olanlar hariç)"
46.43.90,Diğer elektrikli ev aletleri toptan ticareti
46.44,Porselen ve cam eşya ile temizlik maddelerinin toptan ticareti
46.44.01,Porselen ve cam eşyalar ile toprak ve seramikten yapılan ürünlerin toptan ticareti
46.44.02,Temizlik malzemesi toptan ticareti (kişisel temizlik sabunları hariç)
46.44.04,"Cila ve krem (ayakkabı, mobilya, yer döşemesi, kaporta, cam veya metal için) toptan ticareti"
46.45,Parfüm ve kozmetik ürünlerinin toptan ticareti
46.45.01,"Parfüm, kozmetik ürünleri ve kolonya toptan ticareti (ıtriyat dahil)"
46.45.02,Sabun toptan ticareti (kişisel temizlik için)
46.46,Eczacılık ve medikal ürünlerin toptan ticareti
46.46.01,"Cerrahi, tıbbi ve ortopedik alet ve cihazların toptan ticareti"
46.46.02,Temel eczacılık ürünleri ile eczacılık müstahzarlarının toptan ticareti
46.46.03,"Dişçilikte kullanılan alet ve cihazların toptan ticareti (protezler, bağlantı parçaları dahil)"
46.46.04,"Hayvan sağlığı ile ilgili ilaçların toptan ticareti (serum, aşı, vb.)"
46.47,"Ev, büro ve dükkan mobilyası ile halı ve aydınlatma ekipmanlarının toptan ticareti"
46.47.01,Mobilya ve mobilya aksesuarları toptan ticareti (yatak dahil)
46.47.02,"Halı, kilim, vb. yer kaplamaları toptan ticareti"
46.47.03,Aydınlatma ekipmanlarının toptan ticareti
46.47.04,Büro mobilyalarının toptan ticareti
46.48,Saat ve mücevher toptan ticareti
46.48.01,"Mücevher ve takı toptan ticareti (altın, gümüş, vb. olanlar) (imitasyon olanlar hariç)"
46.48.02,Saat toptan ticareti
46.49,Diğer ev eşyalarının toptan ticareti
46.49.01,Deri eşyalar ve seyahat aksesuarları toptan ticareti
46.49.02,Spor malzemesi toptan ticareti
46.49.03,Kırtasiye ürünleri toptan ticareti
46.49.04,Oyun ve oyuncak toptan ticareti
46.49.05,"Hasır eşyalar, mantar eşyalar ve diğer ahşap ürünlerin toptan ticareti (ip vb. için makaralar dahil)"
46.49.06,Müzik aletleri toptan ticareti
46.49.07,Çatal-bıçak takımı ve diğer kesici aletler ile metal sofra ve mutfak eşyalarının toptan ticareti (bakır mutfak eşyaları dahil)
46.49.08,"Tuvalet kağıdı, peçete, kağıt havlu ile kağıt tepsi, tabak, bardak, çocuk bezi vb. toptan ticareti (plastikten olanlar hariç)"
46.49.09,"Sportif amaçlı avcılık ve balıkçılık malzemeleri toptan ticareti (tabanca, av tüfeği ve balık ağları hariç)"
46.49.11,"Kitap, dergi ve gazete toptan ticareti"
46.49.12,"Hediyelik eşya toptan ticareti (pipo, tespih, bakır süs eşyaları, imitasyon takılar dahil)"
46.49.13,"Bisikletler, elektrikli bisikletler, elektrikli tek tekerli taşıt (monowheels), hoverboard, kickscooterlar ve bunların parça ve aksesuarlarının toptan ticareti"
46.49.17,"Plastik sofra, mutfak ve diğer ev eşyası ile tuvalet eşyası toptan ticareti"
46.49.22,"Tıraş bıçakları, usturalar ve jiletlerin toptan ticareti"
46.49.24,"Resim, fotoğraf vb. için çerçeve toptan ticareti"
46.49.25,Arı kovanı toptan ticareti
46.49.26,"Spor ve eğlence amaçlı teknelerin, kayıkların ve kanoların toptan ticareti"
46.49.99,Başka yerde sınıflandırılmamış diğer ev eşyaları ve ev gereçlerinin toptan ticareti
46.5,Bilgi ve iletişim teknolojisi teçhizatının toptan ticareti
46.50,Bilgi ve iletişim teknolojisi teçhizatının toptan ticareti
46.50.01,"Bilgisayar, bilgisayar çevre birimleri ve yazılımlarının toptan ticareti (bilgisayar donanımları, pos cihazları, ATM cihazları vb. dahil)"
46.50.02,Telekomünikasyon ekipman ve parçalarının toptan ticareti (telefon ve iletişim ekipmanları dahil)
46.50.03,"Elektronik cihaz ve parçalarının toptan ticareti (elektronik valfler, tüpler, yarı iletken cihazlar, mikroçipler, entegre devreler, baskılı devreler, vb.) (seyrüsefer cihazları hariç)"
46.50.90,Diğer bilgi ve iletişim teknolojisi ekipmanlarının toptan ticareti
46.6,"Diğer makine, ekipman, aksam ve parçaları ile büro mobilyalarının toptan ticareti"
46.61,Tarımsal amaçlı makine ve ekipmanlar ile aksam ve parçalarının toptan ticareti
46.61.02,"Tarım, hayvancılık ve ormancılık makine ve ekipmanları ile aksam ve parçalarının toptan ticareti"
