Kod,Tanım
24.2,"Çelikten tüpler, borular, içi boş profiller ve benzeri bağlantı parçalarının imalatı"
24.20,"Çelikten tüpler, borular, içi boş profiller ve benzeri bağlantı parçalarının imalatı"
24.20.09,"Çelikten/demirden yapılmış tüp, boru, içi boş profiller ve ilgili bağlantı parçalarının imalatı (sıcak çekilmiş veya sıcak haddelenmiş)"
24.20.10,"Çelikten/demirden yapılmış tüp, boru, içi boş profiller ve ilgili bağlantı parçalarının imalatı (soğuk çekilmiş veya soğuk haddelenmiş)"
24.3,Çeliğin ilk işlenmesinde elde edilen diğer ürünlerin imalatı
24.31,Barların soğuk çekilmesi
24.31.01,Barların soğuk çekilmesi
24.32,Dar şeritlerin soğuk haddelenmesi
24.32.01,Dar şeritlerin soğuk haddelenmesi
24.33,Soğuk şekillendirme veya katlama
24.33.01,Soğuk şekillendirme veya katlama
24.34,Tellerin soğuk çekilmesi
24.34.01,Tellerin soğuk çekilmesi
24.4,Değerli ana metaller ve diğer demir dışı metallerin imalatı
24.41,Değerli metal üretimi
24.41.16,"İşlenmemiş, yarı işlenmiş, toz halde altın imalatı ile gümüş veya adi metallerin altınla preslenerek kaplanması (Mücevher ve benzeri eşyaların imalatı hariç)"
24.41.17,"İşlenmemiş, yarı işlenmiş, toz halde gümüş imalatı ile adi metallerin gümüşle preslenerek kaplanması (Mücevher ve benzeri eşyaların imalatı hariç)"
24.41.18,"İşlenmemiş, yarı işlenmiş, toz halde platin imalatı ile altın, gümüş veya adi metallerin platinle preslenerek kaplanması (paladyum, rodyum, osmiyum ve rutenyum imalatı ile platin katalizör imalatı dahil) (Mücevher ve benzeri eşyaların imalatı hariç)"
24.41.19,Değerli metal alaşımlarının imalatı (Mücevher ve benzeri eşyaların imalatı hariç)
24.42,Alüminyum üretimi
24.42.16,Alüminyum folyo imalatı (alaşımdan olanlar dahil)
24.42.17,Alüminyum imalatı (işlenmemiş halde)
24.42.18,"Alüminyum sac, levha, tabaka, şerit imalatı (alaşımdan olanlar dahil)"
24.42.20,Alüminyum oksit imalatı (suni korindon hariç) (alümina)
24.42.21,"Alüminyum bar, çubuk, tel ve profil, tüp, boru ve bağlantı parçaları imalatı (alaşımdan olanlar dahil)"
24.43,"Kurşun, çinko ve kalay üretimi"
24.43.01,"Kurşun tabaka, levha, şerit, folyo, kurşun tozu ve pulu imalatı (alaşımdan olanlar dahil)"
24.43.02,Kurşun imalatı (işlenmemiş)
24.43.04,"Kalay bar, çubuk, profil, tel, vb. imalatı (alaşımdan olanlar dahil)"
24.43.05,Kalay imalatı (işlenmemiş halde)
24.43.06,Çinko imalatı (işlenmemiş halde)
24.43.07,"Çinko bar, çubuk, profil, tel vb. imalatı (alaşımdan olanlar dahil)"
24.43.08,"Çinko sac, tabaka, levha, şerit, folyo, çinko tozları, vb. imalatı (alaşımdan olanlar dahil)"
24.44,Bakır üretimi
24.44.01,"Bakır, bakır matı, bakır tozu, semente bakır, bakır anotu ile bakır ve bakır alaşımlarının imalatı"
24.44.03,"Bakır sac, tabaka, levha, şerit, folyo imalatı (alaşımdan olanlar dahil)"
24.44.04,"Bakırın çekilmesi ve haddelenmesi ile tüp, boru, bunların bağlantı elemanları, bar, çubuk, tel ve profil imalatı (alaşımdan olanlar dahil)"
24.45,Demir dışı diğer metallerin üretimi
24.45.01,"Maden cevherlerinden ya da oksitlerden işlenmemiş krom, manganez, nikel, tungsten, molibden, tantalum, kobalt, bizmut, titanyum, zirkonyum, berilyum, germanyum vb. imalatı (alaşımları dahil)(atık ve hurdalardan dahil)"
24.45.02,"Krom, manganez, tungsten, molibden, tantalum, kobalt, bizmut, titanyum, zirkonyum, berilyum, germanyum vb. diğer demir dışı metallerden yapılan ürünlerin imalatı (sermetler ve diğer ara ürünler dahil, nikelden olanlar hariç)"
24.45.06,"Nikel matları, nikel oksit sinterleri ve diğer ara ürünleri ile nikel bar, çubuk, profil, tel, levha, şerit, folyo, tüp, boru ve bağlantı parçaları imalatı"
24.46,Nükleer yakıtların işlenmesi
24.46.00,Nükleer yakıtların işlenmesi
24.5,Metal döküm sanayii
24.51,Demir döküm
24.51.13,Demir döküm
24.52,Çelik dökümü
24.52.20,Çelik dökümü
24.53,Hafif metallerin dökümü
24.53.01,Hafif metallerin dökümü
24.54,Diğer demir dışı metallerin dökümü
24.54.02,Değerli metallerin dökümü
24.54.90,Demir dışı diğer metallerin dökümü (değerli metallerin dökümü hariç)
25,Fabrikasyon metal ürünleri imalatı (makine ve teçhizat hariç)
25.1,Metal yapı malzemeleri imalatı
25.11,Metal yapı ve yapı parçaları imalatı
25.11.06,"İnşaat ve inşaatın parçaları için metal çatı ya da iskeletlerin imalatı (kuleler, direkler, destekler, köprüler vb.) (kepenk ve yangın merdiveni ile prefabrik yapılar hariç)"
25.11.07,Metalden kepenk ve yangın merdiveni imalatı
25.11.08,Metalden prefabrik yapı imalatı
25.12,Metalden kapı ve pencere imalatı
25.12.04,"Alüminyum kapı, pencere, bunların kasaları, kapı eşiği, panjur, vb. imalatı"
25.12.05,"Çelik kapı, pencere, bunların kasaları, kapı eşiği, panjur, vb. imalatı"
25.12.06,"Demir kapı, pencere, bunların kasaları, kapı eşiği, panjur, vb. imalatı (bahçe kapıları dahil)"
25.2,"Metal tank, rezervuar ve muhafaza kapları imalatı"
25.21,"Merkezi ısıtma radyatörleri, buhar jeneratörleri ve sıcak su kazanlarının (boylerleri) imalatı"
25.21.10,Merkezi ısıtma radyatörleri imalatı (elektrikli radyatörler ile döküm olanlar hariç)
25.21.11,"Merkezi ısıtma kazanları (boyler) imalatı (kombi, kat kaloriferi ve diğer merkezi ısıtma kazanları,) (buhar jeneratörleri ve kızgın su üreten kazanlar hariç)"
25.21.12,"Merkezi ısıtma radyatörleri imalatı, döküm olanlar (elektrikli radyatörler hariç)"
25.21.13,"Buhar üretim kazanları (buhar jeneratörü), kızgın su kazanları (boyler), denizcilik veya enerji kazanları ile bunların parçaları ile kazanlar (boylerler) için yardımcı üniteler ve buhar veya diğer buhar güç üniteleri için kondansatör imalatı"
25.21.14,Nükleer reaktörler ve nükleer reaktör parçası imalatı (izotop ayırıcılar hariç)
25.22,"Metalden diğer tank, rezervuar ve konteynerler imalatı"
25.22.01,"Metalden rezervuarlar, tanklar, fıçılar ve benzeri kapasitesi > 300 litre olan konteynerlerin imalatı (sıkıştırılmış veya sıvılaştırılmış gazlar için olanlar ile mekanik veya termal ekipmanlı olanlar hariç)"
25.22.02,Sıkıştırılmış veya sıvılaştırılmış gaz için kullanılan metal konteynerlerin imalatı
25.3,Silah ve mühimmat (cephane) imalatı
25.30,Silah ve mühimmat (cephane) imalatı
25.30.03,"Tabanca, revolver (altıpatlar), av tüfeği, havalı tabanca, cop, vb. askeri amaçlı olmayan ateşli silahlar ve benzeri aletlerin ve bunların parçalarının imalatı"
25.30.04,"Askeri silah ve bunların parçalarının imalatı (büyük toplar, savaş araçları, füzeatarlar, torpil kovanları, ağır makineli tüfekler, vb.)"
25.30.05,"Bomba, füze ve benzeri savaş gereçleri, fişekler, diğer mermi ve mühimmatlar ile bunların parçalarının imalatı"
25.4,"Metallerin dövülmesi, şekil verilmesi ve toz metalürjisi"
25.40,"Metallerin dövülmesi, şekil verilmesi ve toz metalürjisi"
25.40.04,"Metallerin dövülmesi, preslenmesi, baskılanması ve damgalanması"
25.40.05,Toz metalürjisi
25.5,Metallerin işlenmesi ve kaplanması; makinede işleme
25.51,Metallerin kaplanması
25.51.01,Metallerin nikel ile kaplanması (nikelajcılık) faaliyeti
25.51.02,Metallerin kalay ile kaplanması (kalaycılık) faaliyeti
25.51.09,Metallerin diğer malzemelerle kaplanması (ısıl işlem hariç)
25.52,Metallerin ısıl işlemi
25.52.00,Metallerin ısıl işlemi
25.53,Metallerin makinede işlenmesi ve şekil verilmesi
25.53.01,"Metallerin makinede işlenmesi (torna tesfiye işleri, metal parçaları delme, tornalama, frezeleme, rendeleme, parlatma, oluk açma, perdahlama, birleştirme, kaynak yapma, çapak alma, kumlama, vb. faaliyetler)"
25.53.02,"CNC oksijen, CNC plazma, CNC su jeti vb. makinelerinin kullanılması yoluyla metallerin kesilmesi veya üzerlerinin yazılması"
25.53.03,Lazer ışınlarının kullanılması yoluyla metallerin kesilmesi veya üzerlerinin yazılması
25.6,Çatal-bıçak takımı ve diğer kesici aletler ile el aletleri ve genel hırdavat malzemeleri imalatı
25.61,Çatal-bıçak takımı ve diğer kesici aletlerin imalatı
25.61.04,"Kaşık, çatal, kepçe, kevgir, servis spatulası, şeker maşası ve benzeri mutfak gereçleri, sofra takımları, çatal bıçak takımları imalatı (balık bıçakları, kahvaltı ve meyve bıçakları dahil fakat, sofra bıçakları hariç)"
25.61.05,"Tıraş bıçakları, usturalar ile jiletler ve tıraş makinelerinin bıçaklarının imalatı"
25.61.06,"Sofra bıçakları (balık bıçakları, kahvaltı ve meyve bıçakları hariç), budama bıçakları, sustalı bıçaklar, satır,balta vb. bıçaklar (makineler için olanlar hariç) ile terzi makasları, vb. makaslar ve bunların ağızlarının imalatı"
25.61.07,"Manikür veya pedikür setleri ve aletleri, kağıt bıçakları, mektup açacakları, kalemtıraşlar ve bunların bıçakları, kırma, yarma ve kıyma bıçakları, saç kesme ve hayvan kırkma makine ve aletleri ile benzeri elektriksiz kesici aletlerin imalatı"
25.61.08,"Kılıç, pala, kasatura, mızrak, süngü, avcı bıçağı ve benzeri silahlar ile bunların parçalarının imalatı"
25.62,Kilit ve menteşe imalatı
25.62.04,Kilit ve menteşe imalatı
25.63,"El aletleri, takım tezgahı uçları, testere ağızları vb. imalatı"
25.63.01,Metalden kalıp ve döküm modeli imalatı (kek ve ayakkabı kalıpları hariç)
25.63.02,Plastikten kalıp ve döküm modeli imalatı (kek ve ayakkabı kalıpları hariç)
25.63.03,Ahşap ve diğer malzemelerden kalıp ve döküm modeli imalatı (kek ve ayakkabı kalıpları hariç)
25.63.04,"El aletleri, takım tezgahı uçları, testere ağızları, mengeneler, kıskaçlar, sıkıştırma anahtarları vb. imalatı (makineler veya mekanik cihazlar için değiştirilebilen uçlar dahil)"
25.9,Diğer fabrikasyon metal ürünlerin imalatı
25.91,Çelik varil ve benzer muhafazaların imalatı
25.91.01,Çelik varil ve benzer muhafazaların imalatı
25.92,Metalden hafif paketleme malzemeleri imalatı
25.92.01,"Demir veya çelikten yiyecek, içecek ve diğer ürünler için kapasitesi < 50 litre olan kutuların imalatı (lehim veya kıvrılarak kapatılanlar) (tenekeden olanlar dahil)"
25.92.02,Adi metalden dişli kapaklar (şişe kapağı vb.) ve tıpalar ile tıkaçlar ve kapakların imalatı
25.92.03,"Kapasitesi 300 lt.yi geçmeyen alüminyum varil fıçı, kova vb. imalatı (diş macunu, krem gibi kapaklı tüpler ve katlanabilir kutular ile aerosol kutuları dahil)"
25.93,"Tel ürünleri, zincir ve yayların imalatı"
25.93.01,"Metalden zincirler (mafsallı bağlantı zinciri hariç) ve parçaları ile yay ve yay yaprakları, kaplanmış veya nüveli teller, çubuklar, tüpler, levhalar ve elektrotların imalatı (elektrik işlerinde kullanılanlar ile elektrik yalıtımı olanlar hariç)"
25.93.02,"İğne, çengelli iğne, çuvaldız, örgü şişi, tığ, raptiye, çivi, vb. imalatı"
25.93.03,"Telden yapılan diğer ürünlerin imalatı (örgülü tel, örme şerit,örme halat, taşıma askısı, dikenli tel (elektrik yalıtımı olanlar hariç) ve demir, çelik veya bakır tellerden mensucat, ızgara, ağ, kafeslik ve çitler)"
25.94,Bağlantı malzemelerinin ve vida makinesi ürünlerinin imalatı
25.94.01,"Yivsiz bağlantı malzemeleri imalatı, demir, çelik veya bakırdan (rondelalar, perçinler, perçin çivileri, kamalı pimler, kopilyalar vb. ürünler)"
25.94.02,"Yivli bağlantı malzemeleri imalatı, demir, çelik veya bakırdan (vidalar, cıvatalar, somunlar vb. yivli ürünler)"
25.99,Başka yerde sınıflandırılmamış diğer fabrikasyon metal ürünlerin imalatı
25.99.01,"Demir, çelik ve alüminyumdan sofra ve mutfak eşyalarının imalatı (tencere, tava, çaydanlık, cezve, yemek kapları, bulaşık telleri vb.) (teflon, emaye vb. ile kaplanmışlar dahil, bakırdan olanlar hariç)"
25.99.02,"Metalden yapılmış eviye, lavabo, küvet, duş teknesi, jakuzi (emaye olsun ya da olmasın) ve diğer sıhhi ürünlerin imalatı"
25.99.03,"Zırhlı veya güçlendirilmiş kasalar, kasa daireleri, kilitli para kasaları, zırhlı kapılar vb. imalatı (adi metalden)"
25.99.04,"Adi metalden büro malzemeleri imalatı (dosya kutuları, kaşeler, zımba telleri, kağıt ataçları vb.)"
25.99.05,"Adi metalden tokalar, klipsli çanta sapları, kemer tokaları, kancalar, halkalar, kuş gözü halkalar ve benzerleri (giysi, ayakkabı, tente, el çantası, seyahat eşyası veya diğer hazır eşya için kullanılan türde) ile adi metallerden boru şeklinde veya çatallı perçinler; boncuklar vb. imalatı"
25.99.06,"Bakırdan sofra ve mutfak eşyası imalatı (cezve, tencere, çanak, tabak, ibrik vb.)"
25.99.08,"Metalden gemi ve tekne pervaneleri ve bunların aksamları ile çıpalar, filika demirleri vb. imalatı"
25.99.12,"Kalıba dökülerek yapılan zil, çan, gong vb. eşyalar ile adi metallerden kalıba dökülerek yapılan biblo, heykelcik ve diğer süs eşyası imalatı (bisiklet zilleri dahil ancak bakırdan olanlar ile mutfak eşyaları hariç)"
25.99.13,"Metalden çatı olukları, çatı kaplamaları vb. imalatı"
25.99.14,"Adi metallerden işaret levhaları ve tabelalar ile rakamlar, harfler ve diğer sembollerin imalatı (oto plakaları dahil, ışıklı olanlar hariç)"
25.99.15,"Kurşun tüp, boru ve bunların bağlantı parçaları ile kurşun bar, çubuk, profil, tel vb. imalatı (alaşımdan olanlar dahil)"
25.99.18,"Bakırdan yapılan biblolar, çerçeveler, aynalar ve diğer süsleme eşyaları ile süsleme işleri (mutfak eşyaları hariç)"
25.99.21,"Metalden elektriksiz hazneli döner bacaların, havalandırma kanallarının vb. imalatı"
25.99.99,Başka yerde sınıflandırılmamış diğer fabrikasyon metal ürünlerin imalatı
26,"Bilgisayarların, elektronik ve optik ürünlerin imalatı"
26.1,Elektronik bileşenlerin ve devre kartlarının imalatı
26.11,Elektronik bileşenlerin imalatı
26.11.04,"Diyotların, transistörlerin, diyakların, triyaklar, tristör, rezistans, ledler, kristal, röle, mikro anahtar, sabit veya ayarlanabilir direnç ve kondansatörler ile elektronik entegre devrelerin imalatı"
26.11.05,"Katot ışınlı görüntü tüpleri, televizyon kamerası tüpleri ve magnetronlar, klistronlar, mikrodalga tüpleri ve diğer valf tüplerinin, LCD ve plazma TV panelleri ve göstergelerin imalatı"
26.11.06,Çıplak baskılı devre kartlarının imalatı
26.11.99,Başka yerde sınıflandırılmamış diğer elektronik bileşenlerin imalatı
26.12,Yüklü elektronik kart imalatı
26.12.01,"Yüklü elektronik kart imalatı (yüklü baskılı devre kartları, ses, görüntü, denetleyici, ağ ve modem kartları ile akıllı kartlar vb.)"
26.2,Bilgisayar ve bilgisayar çevre birimleri imalatı
26.20,Bilgisayar ve bilgisayar çevre birimleri imalatı
26.20.01,Bilgisayar ve bilgisayar çevre birimleri imalatı
26.3,İletişim ekipmanlarının imalatı
26.30,İletişim ekipmanlarının imalatı
26.30.02,Radyo ve televizyon stüdyoları ve yayın teçhizatları ile radyo ve televizyon iletim cihazlarının imalatı (tv kameraları ve baz istasyonları dahil)
26.30.03,Kızıl ötesi (enfraruj) sinyal kullanan iletişim cihazlarının imalatı (örn: uzaktan kumanda cihazları)
26.30.05,"Alıcı ve verici antenlerin imalatı (harici, teleskopik, çubuk, uydu, çanak ve hava ve deniz taşıtlarının antenleri)"
26.30.06,"Kablolu ve kablosuz telefon, cep telefonu, kablolu görüntülü telefon, çağrı cihazı ve faks cihazı imalatı (telesekreter imalatı dahil)"
26.30.08,"Merkezi iletişim santral donanımları ile sayısal veya analog telefon-telgraf santrallerinin ve ağ geçitleri, köprüleri, yönlendiricileri gibi veri iletim donanımlarının imalatı (mors veya mors tipi kaydedici ve anahtarlar dahil)"
26.30.09,Hırsız ve yangın alarm sistemleri ve kapı konuşma sistemlerinin (diyafon) (görüntülü olanlar dahil) imalatı (motorlu kara taşıtları için alarm sistemleri hariç)
26.30.10,"Ses, görüntü veya diğer verilerin alınması, dönüştürülmesi, iletilmesi/yeniden oluşturulması için kullanılan diğer makinelerin imalatı (alıcısı/vericisi bulunan telgraf, teleks cihazları ile anahtarlama ve yönlendirme cihazları dahil)"
26.30.99,Başka yerde sınıflandırılmamış diğer iletişim ekipmanlarının imalatı
26.4,Tüketici elektroniği ürünlerinin imalatı
26.40,Tüketici elektroniği ürünlerinin imalatı
26.40.08,"Ses ve görüntü oynatıcı ve kaydedicileri, ev tipi video kameralar ve diğer görüntü kayıt veya görüntü çoğaltma cihazlarının imalatı"
26.40.09,Radyo ve televizyon imalatı (taşıtlarda kullanılanlar dahil)
26.40.10,"Mikrofon, hoparlör ve kulaklıklar ile elektrikli ses yükselteçlerinin (amplifikatörler) imalatı"
26.40.11,Monitörler ve projektörlerin imalatı (bilgisayar gibi bir otomatik veri işleme sisteminde kullanılmayanlar)
26.40.12,Video oyun ve konsollarının (televizyonla kullanılanlar ve kendi ekranı olanlar) imalatı
26.40.99,Başka yerde sınıflandırılmamış tüketici elektroniği ürünlerinin imalatı
26.5,Ölçme ve test cihazları ile saat imalatı
26.51,"Ölçme, test ve seyrüsefer (navigasyon) amaçlı alet ve cihazların imalatı"
26.51.01,Hırsız ve yangın alarm sistemleri imalatı (bir kontrol istasyonuna sinyal gönderenler) (motorlu kara taşıtları için olanlar hariç)
26.51.02,"Dedektör imalatı (yeraltı kaynakları, maden, mayın, güvenlik kontrol, radyasyon vb. dedektörleri)"
26.51.03,"Elektrik miktarını (volt, akım vb.) ölçmek ve kontrol etmek için kullanılan alet ve cihazların imalatı (avometre, voltmetre, osiloskop ile diğer voltaj, akım, direnç veya elektrik gücünü ölçüm veya kontrol için olanlar) (elektrik sayaçları hariç)"
26.51.04,"Hız ve mesafe ölçümünde kullanılan alet ve cihazların imalatı (taşıt hız göstergesi, takometre, taksimetre vb.)"
26.51.05,"Isı ve sıcaklık ölçümünde kullanılan alet ve cihazların imalatı (termometre, termostat, pirometre vb.)"
26.51.06,"Işık, ışın ve renk ölçümünde kullanılan alet ve cihazların imalatı (polarimetre, kolorimetre, refraktometre vb.)"
26.51.07,Meteorolojide kullanılan alet ve cihazların imalatı
26.51.08,"Yön bulma pusulaları ile diğer seyrüsefer alet ve cihazlarının, radar ve sonar cihazlarının imalatı (hava, kara ve deniz taşımacılığında kullanılanlar dahil)"
26.51.09,"Hava, sıvı ve gazların akış, seviye, basınç veya diğer değişkenlerini ölçme ve kontrol etme için kullanılan aletlerin imalatı (hidrometre, debimetre, barometre, higrometre vb.)"
26.51.10,"Gaz, sıvı veya elektrik üretim veya tüketim sayaçlarının imalatı"
26.51.11,"Teçhizatlı çizim masaları ve makineleri ile diğer çizim, işaretleme veya matematiksel hesaplama aletlerinin imalatı (pergel takımı, pantograf, resim, çizim, hesap yapmaya mahsus elektrikli/elektronik çiziciler vb. dahil)"
26.51.12,"Laboratuvar, kuyumculuk vb. yerlerde kullanılan hassas tartıların imalatı"
26.51.13,Sanayide kullanılan işlem kontrol amaçlı teçhizatların imalatı
26.51.14,"Telemetreler, teodolitler ve diğer arazi ölçümü, hidrografik, oşinografik, hidrolojik veya jeofizik alet ve cihazlarının imalatı"
26.51.15,"Seyrüsefere yardımcı telsiz cihazları ile uzaktan kumandalı kontrol cihazlarının (roketler, füzeler, makineler vb) imalatı"
26.51.99,"Başka yerde sınıflandırılmamış ölçme, test ve seyrüsefer amaçlı alet ve cihazların imalatı (hidrolik veya pnömatik otomatik ayar veya kontrol aletleri ile milometreler, pedometreler, stroboskoplar, monostatlar, kumpaslar, spektrometreler dahil)"
26.52,"Kol saatlerinin, masa ve duvar saatlerinin ve benzerlerinin imalatı"
26.52.03,"Devam kayıt cihazları, zaman kayıt cihazları, parkmetreler; duvar ve kol saati makineli zaman ayarlı anahtarların imalatı (vardiya saati vb.)"
26.52.04,"Kol, masa, duvar ve cep saatlerinin, bunların makinelerinin, kasalarının ve diğer parçalarının imalatı (kronometreler ve taşıtlar için gösterge panellerinde bulunan saatler ve benzeri tipteki saatler dahil)"
26.6,"Işınlama, elektro medikal ve elektro terapi ile ilgili cihazların imalatı"
26.60,"Işınlama, elektro medikal ve elektro terapi ile ilgili cihazların imalatı"
26.60.01,"Işınlama, elektro medikal ve elektro terapi ile ilgili cihazların imalatı"
26.7,"Optik aletlerin, manyetik ve optik medyanın ve fotoğrafik ekipmanların imalatı"
26.70,"Optik aletlerin, manyetik ve optik medyanın ve fotoğrafik ekipmanların imalatı"
26.70.11,"Objektif merceği, levha ve tabaka halinde polarizan madde, renk filtresi, optik mercek, prizma, ayna ve diğer optik elemanlar ile dürbün, optik mikroskop, optik teleskop ve diğer astronomik aletler ile bunların aksam ve parçalarının imalatı"
26.70.12,"Mikrofilm, mikrofiş ve diğer mikroform okuyucuların imalatı"
26.70.13,"Sinematografik kameraların ve projektörlerin, diyapozitif (slayt) ve diğer projektörlerin imalatı"
26.70.16,"Fotoğraf makinesi imalatı (dijital, anında görüntü basan, dokümanların mikrofilm, vb. üzerine kaydedilmesinde, deniz altında, hava fotoğrafçılığında, adli tıp veya kriminolojik laboratuvarlarda, vb. kullanılanlar)"
26.70.19,"Flaş lambaları, fotografik agrandisörler (büyütücüler), fotoğraf laboratuvarları için cihazlar, negatoskoplar (ince ışıklı panel), projeksiyon ekranları, likit kristal cihazlar ile lazerlerin (lazer diyotlar hariç) imalatı"
26.70.20,Boş manyetik ses ve görüntü kaset bantlarının imalatı (plak dahil)
26.70.21,Manyetik şeritli kartların imalatı (boş telefon kartı dahil)
26.70.22,"Boş CD, DVD, disket, mavi ışınlı (blu-ray) disk, vb. ürünlerin imalatı (disk üretimi için kullanılan kalıp (matris) ve master dahil)"
26.70.99,Başka yerde sınıflandırılmamış manyetik ve optik ortamların imalatı
27,Elektrikli teçhizat imalatı
27.1,"Elektrik motoru, jeneratör, transformatör ile elektrik dağıtım ve kontrol cihazlarının imalatı"
27.11,"Elektrik motorları, jeneratörler ve transformatörlerin imalatı"
27.11.01,"Elektrik motoru, jeneratör ve transformatörlerin imalatı (aksam ve parçaları hariç)"
27.11.03,"Elektrik motoru, jeneratör ve transformatörlerin aksam ve parçalarının imalatı"
27.12,Elektrik dağıtım ve kontrol cihazları imalatı
27.12.01,Elektrik dağıtım ve kontrol cihazları imalatı
27.12.02,Elektrik dağıtım ve kontrol cihazlarının aksam ve parçalarının imalatı
27.2,Akümülatör ve pil imalatı
27.20,Akümülatör ve pil imalatı
27.20.01,"Elektrik akümülatör parçalarının imalatı (akümülatör plakaları, separatörler, kurşun ızgaralar) (akümülatör kutu ve kapaklarının imalatı hariç)"
27.20.02,"Şarj edilemeyen (birincil) pil ve bataryalar ile bunların aksam ve parçalarının imalatı (manganez dioksitli, cıva oksitli, gümüş oksitli, lityum oksitli, çinko-hava reaksiyonlu pil ve bataryalar)"
27.20.03,"Akümülatör imalatı (kurşun asitli, nikel kadmiyum, nikel metal hidrit, lityum-iyon, lityum polimer, nikel demir ve diğer elektrik akümülatörleri)"
27.20.04,Şarj edilebilir pil ve batarya ile bunların parçalarının imalatı
27.20.05,Akümülatör kutu ve kapaklarının imalatı
27.3,Kablolamada kullanılan teller ve kablolar ile gereçlerin imalatı
27.31,Fiber optik kabloların imalatı
27.31.04,Fiber optik kabloların imalatı
27.32,Diğer elektronik ve elektrikli teller ve kabloların imalatı
27.32.03,Diğer elektronik ve elektrikli teller ve kabloların imalatı
27.33,Kablolamada kullanılan gereçlerin imalatı
27.33.00,Kablolamada kullanılan gereçlerin imalatı
27.4,Aydınlatma ekipmanları imalatı
27.40,Aydınlatma ekipmanları imalatı
27.40.01,"Ampul, flaş küpü ve benzerlerinin imalatı"
27.40.02,"Hava ve motorlu kara taşıtları için monoblok far üniteleri, kara, hava ve deniz taşıtları için elektrikli aydınlatma donanımları veya görsel sinyalizasyon ekipmanları imalatı (polis araçları, ambulans vb. araçların dış ikaz lambaları dahil)"
27.40.03,"Avize, aplik ve diğer elektrikli aydınlatma armatürleri, sahne, fotoğraf veya sinema stüdyoları için projektörler ve spot ışıkları, elektrikli masa lambaları, çalışma lambaları, abajur vb. lambaların imalatı (süsleme için ışıklandırma setleri dahil)"
27.40.04,Sokak aydınlatma donanımlarının imalatı (trafik ışıkları hariç)
27.40.05,"Pil, akümülatör veya manyeto ile çalışan portatif elektrik lambaları ve elektriksiz lambalar ile el feneri, gaz ve lüks lambası vb. aydınlatma armatürlerinin imalatı (taşıtlar için olanlar hariç)"
27.40.06,"Işıklı tabela, ışıklı reklam panosu ve benzerlerinin imalatı"
27.40.99,Başka yerde sınıflandırılmamış aydınlatma ekipmanları imalatı
27.5,Ev aletleri imalatı
27.51,Elektrikli ev aletlerinin imalatı
27.51.02,"Ev tipi elektrikli su ısıtıcıları (depolu su ısıtıcıları, anında su ısıtıcıları, şofben, termosifon dahil), elektrikli ısıtma cihazları (elektrikli soba, radyatör, vb.) ve elektrikli toprak ısıtma cihazlarının imalatı"
27.51.03,"Ev tipi elektrikli süpürge ve halı temizleme/yıkama makineleri ile kuru veya ıslak elektrikli süpürgeler, şarjlı veya pilli el süpürgelerinin imalatı"
