Kod,Tanım
47.69.99,Başka yerde sınıflandırılmamış diğer kültür ve eğlence (rekreasyon) ürünlerinin perakende ticareti
47.7,"Diğer malların perakende ticareti, motorlu kara taşıtları ve motosikletler hariç"
47.71,Giyim eşyalarının perakende ticareti
47.71.01,Bebek ve çocuk giyim eşyası perakende ticareti
47.71.02,"Giysi aksesuarları perakende ticareti (eldiven, kravat, şapka, eşarp, şal, mendil, kemer, pantolon askısı, şemsiye, baston, vb.)"
47.71.03,Kürklü deriden giyim eşyalarının perakende ticareti (işlenmiş kürklü deriler dahil)
47.71.04,"Diğer dış giyim perakende satışı (palto, kaban, anorak, takım elbise, ceket, pantolon, şort (tekstil kumaşından veya örgü ve tığ işi))"
47.71.05,İç giyim ve çorap perakende ticareti
47.71.07,Deri veya deri bileşimli giyim eşyası perakende ticareti
47.71.08,"Süveter, kazak, hırka, yelek ve benzeri eşyaların perakende ticareti"
47.71.09,İş giysisi perakende ticareti
47.71.11,Spor giysisi perakende ticareti
47.71.12,Gelinlik perakende ticareti
47.71.13,"Tezgahlar ve pazar yerleri vasıtasıyla iç giyim eşyası, dış giyim eşyası, çorap, giysi aksesuarı ve ayakkabı perakende ticareti (seyyar satıcılar hariç)"
47.71.99,"Belirli bir mala tahsis edilmiş mağazalarda başka yerde sınıflandırılmamış giyim eşyası perakende ticareti (plastikten, vulkanize kauçuktan, kağıttan, dokusuz kumaştan ya da emdirilmiş veya kaplanmış tekstil kumaşından giysiler)"
47.72,Ayakkabı ve deri eşyaların perakende ticareti
47.72.01,"Ayakkabı, terlik vb. perakende ticareti (kavafiye dahil; spor ayakkabıları ile tamamı tekstilden olanlar hariç)"
47.72.02,"Bavul, el çantası ve diğer seyahat aksesuarlarının perakende ticareti (deriden, deri bileşimlerinden, plastik levhadan, tekstil malzemesinden, vulkanize (ebonit) elyaf veya mukavvadan)"
47.72.05,"Saraciye ürünleri ve koşum takımı perakende ticareti (eyer, semer, vb.)"
47.72.06,"Ayakkabı parçaları perakende ticareti (deri, ayakkabı sayası, topuk, topuk yastığı, ayakkabı bağları vb.)"
47.72.90,Deriden veya deri bileşimlerinden diğer ürünlerin perakende ticareti (deri veya deri bileşimli giyim eşyası hariç)
47.73,Eczacılık ürünlerinin perakende ticareti
47.73.01,Eczacılık ürünlerinin perakende ticareti
47.73.02,Veterinerlik ürünlerinin perakende ticareti
47.74,Medikal ve ortopedik ürünlerin perakende ticareti
47.74.01,Tıbbi ve ortopedik ürünlerin perakende ticareti
47.74.02,"Gözlük, kontak lens, gözlük camı vb. perakende ticareti"
47.75,Kozmetik ve kişisel bakım malzemelerinin perakende ticareti
47.75.01,Kozmetik ve kişisel bakım malzemelerinin perakende ticareti
47.75.02,Tezgahlar ve pazar yerleri vasıtasıyla kişisel bakım ve kozmetik ürünleri ile temizlik ürünleri perakende ticareti (seyyar satıcılar hariç)
47.76,"Çiçek, bitki, gübre, ev hayvanları ve ev hayvanları yemleri perakende ticareti"
47.76.01,"Ev hayvanları, bunların mama ve gıdaları ile eşyalarının perakende ticareti"
47.76.02,"Çiçek, bitki ve tohum perakende ticareti"
47.76.03,Gübre ve zirai kimyasal ürünlerin perakende ticareti
47.76.04,Canlı büyükbaş ve küçükbaş hayvanların perakende ticareti (ev hayvanları hariç)
47.76.05,Canlı kümes hayvanlarının perakende ticareti
47.76.06,"Tezgahlar ve pazar yerleri vasıtasıyla çiçek, bitki ve bitki tohumu (çiçek toprağı ve saksıları dahil) perakende ticareti (seyyar satıcılar hariç)"
47.76.07,"Tezgahlar ve pazar yerleri vasıtasıyla canlı büyük ve küçükbaş hayvan, canlı kümes hayvanı, ev hayvanı ve yemlerinin perakende ticareti (seyyar satıcılar hariç)"
47.77,Saat ve mücevher perakende ticareti
47.77.01,"Altın ve diğer değerli metallerden takı, eşya ve mücevherat perakende ticareti (kuyumculuk ürünleri perakende ticareti dahil, gümüşten olanlar hariç)"
47.77.02,"Gümüş takı, eşya ve mücevherat perakende ticareti (gümüşçü ürünleri perakende ticareti)"
47.77.03,"Saat (kol, masa, duvar vb. saatler ile kronometreler) perakende ticareti"
47.77.05,"Doğal inciden veya kültür incisinden ürünler ile değerli ya da yarı değerli taşlardan yapılan ürünlerin perakende ticareti (pırlanta, yakut, zümrüt, safir vb.den yapılan ürünler)"
47.78,Diğer yeni malların perakende ticareti
47.78.02,Kömür ve yakacak odun perakende ticareti
47.78.04,"Hediyelik eşyaların, el işi ürünlerin ve imitasyon takıların perakende ticareti (sanat eserleri hariç)"
47.78.07,"Optik ve hassas aletlerin perakende ticareti (mikroskop, dürbün ve pusula dahil; gözlük camı, fotoğrafik ürünler hariç)"
47.78.08,"Büro makine ve ekipmanlarının perakende ticareti (hesaplama makineleri, daktilolar, fotokopi makineleri, tarama ve faks cihazları, çizim masaları vb.)"
47.78.09,Evlerde kullanılan fuel oil perakende ticareti
47.78.10,Evlerde kullanılan tüpgaz perakende ticareti
47.78.15,"Temizlik malzemesi perakende ticareti (Arap sabunu, deterjan, yumuşatıcılar, şampuanlar vb. dahil; kişisel hijyen için olanlar hariç)"
47.78.16,"Yün, tiftik vb. perakende ticareti"
47.78.22,Fotoğrafçılık malzemeleri ve aletlerinin perakende ticareti
47.78.26,"Yapma çiçek, yaprak ve meyveler ile mum perakende ticareti"
47.78.30,"Tekstilden çuval, torba, vb. perakende ticareti (eşya paketleme amacıyla kullanılanlar)"
47.78.31,"Mağaza, tezgah, pazar yeri dışında müşterinin istediği yere ulaştırılarak yapılan doğrudan yakıt satışı (kalorifer yakıtı, yakacak odun, vb.)"
47.78.99,Başka yerde sınıflandırılmamış diğer yeni malların perakende ticareti
47.79,Kullanılmış malların perakende ticareti
47.79.01,Antika perakende ticareti
47.79.03,İkinci el kitapların perakende ticareti (sahafların faaliyetleri)
47.79.04,"Kullanılmış mobilya, elektrikli ve elektronik ev eşyası perakende ticareti"
47.79.06,Kullanılmış giysiler ve aksesuarlarının perakende ticareti
47.79.90,Diğer ikinci el eşya perakende ticareti (ikinci el motorlu kara taşıtları ve motosiklet parçaları hariç)
47.8,"Motorlu kara taşıtlarının, motosikletlerin ve ilgili parçalarının ve aksesuarlarının perakende ticareti"
47.81,Motorlu kara taşıtlarının perakende ticareti
47.81.14,Otomobillerin ve hafif motorlu kara taşıtlarının perakende ticareti (elektrikli olanlar ile ambulans ve minibüs benzeri motorlu yolcu taşıtları dahil)
47.81.90,"Diğer motorlu kara taşıtlarının perakende ticareti (kamyonlar, çekiciler, römorklar, yarı römorklar, kamp araçları vb., elektrikli olanlar dahil)"
47.82,Motorlu kara taşıtlarının parça ve aksesuarlarının perakende ticareti
47.82.04,Motorlu kara taşıtı lastiklerinin ve jantlarının perakende ticareti (motosiklet parça ve aksesuarları hariç)
47.82.05,Motorlu kara taşıtı camlarının perakende ticareti (motosiklet parça ve aksesuarları hariç)
47.82.06,Motorlu kara taşıtlarının ikinci el (kullanılmış) parçalarının perakende ticareti (motosiklet parça ve aksesuarları hariç)
47.82.07,Motorlu kara taşıtlarının aksesuarlarının perakende ticareti (motosiklet parça ve aksesuarları hariç)
47.82.08,Motorlu kara taşıtlarının akülerinin perakende ticareti
47.82.90,Motorlu kara taşıtlarının diğer parça ve aksesuarlarının perakende ticareti
47.83,"Motosikletlerin, motosiklet parçalarının ve aksesuarlarının perakende ticareti"
47.83.01,Motosikletler ve motorlu bisikletlerin perakende ticareti
47.83.02,Motosikletler ve motorlu bisikletlerin parça ve aksesuarlarının perakende ticareti
47.9,Perakende ticaret için aracılık hizmeti faaliyetleri
47.91,Uzmanlaşmamış perakende ticaret için aracılık hizmeti faaliyetleri
47.91.14,"Radyo, TV, posta yoluyla veya internet üzerinden yapılan perakende ticaret"
47.91.15,Uzmanlaşmamış perakende ticaret için aracılık hizmeti faaliyetleri
47.92,Uzmanlaşmış perakende ticaret için aracılık hizmeti faaliyetleri
47.92.00,Uzmanlaşmış perakende ticaret için aracılık hizmeti faaliyetleri
H,ULAŞTIRMA VE DEPOLAMA
49,Kara taşımacılığı ve boru hattı taşımacılığı
49.1,Demir yolu ile yolcu taşımacılığı
49.11,Demir yolu ile yolcu taşımacılığı (ağır raylı sistem)
49.11.00,Demir yolu ile şehirler arası yolcu taşımacılığı
49.12,Diğer demir yolu ile yolcu taşımacılığı
49.12.00,Diğer demir yolu ile yolcu taşımacılığı (gezi amaçlı taşımacılık dahil)
49.2,Demir yolu ile yük taşımacılığı
49.20,Demir yolu ile yük taşımacılığı
49.20.01,Demir yolu ile yük taşımacılığı
49.3,Kara taşımacılığı ile yapılan diğer yolcu taşımacılığı
49.31,Kara yoluyla tarifeli yolcu taşımacılığı
49.31.04,Halk otobüsü/otobüs ile yapılan şehir içi ve banliyö yolcu taşımacılığı
49.31.05,Belediye otobüsü ile yapılan şehir içi ve banliyö yolcu taşımacılığı (belediyenin sağladığı havaalanı otobüsü dahil)
49.31.06,Minibüs ve dolmuş ile yapılan şehir içi ve banliyö yolcu taşımacılığı (belirlenmiş güzergahlarda)
49.31.07,"Kara yolu (otobüs, vb.) ile uluslararası yolcu taşımacılığı"
49.31.08,Şehirler arası tarifeli kara yolu yolcu taşımacılığı
49.31.09,"Şehir içi, banliyö ve kırsal alanlarda kara yolu ile personel, öğrenci, vb. grup taşımacılığı (şehir içi personel ve okul servisleri, vb.)"
49.31.10,Kara yolu şehir içi ve şehirler arası havaalanı servisleri ile yolcu taşımacılığı
49.31.90,Kara yoluyla tarifeli diğer yolcu taşımacılığı
49.32,Kara yoluyla tarifesiz yolcu taşımacılığı
49.32.04,Kara yoluyla tarifesiz yolcu taşımacılığı
49.33,Sürücülü araç ile isteğe bağlı yolcu taşıma hizmeti faaliyetleri
49.33.01,Taksi ile yolcu taşımacılığı
49.33.02,Sürücüsü ile birlikte diğer özel araç kiralama faaliyeti
49.34,Teleferik ve telesiyejlerle yolcu taşımacılığı
49.34.00,Teleferik ve telesiyejlerle yolcu taşımacılığı
49.39,Başka yerde sınıflandırılmamış kara taşımacılığı ile yapılan diğer yolcu taşımacılığı
49.39.00,Başka yerde sınıflandırılmamış kara taşımacılığı ile yapılan diğer yolcu taşımacılığı
49.4,Kara yolu ile yük taşımacılığı ve taşımacılık hizmetleri
49.41,Kara yolu ile yük taşımacılığı
49.41.01,"Kara yolu ile şehir içi yük taşımacılığı (gıda, sıvı, kuru yük vb.) (gaz ve petrol ürünleri hariç)"
49.41.02,"Kara yolu ile şehirler arası yük taşımacılığı (gıda, sıvı, kuru yük, vb.) (gaz ve petrol ürünleri hariç)"
49.41.03,"Kara yolu ile uluslararası yük taşımacılığı (gıda, sıvı, kuru yük, vb.) (gaz ve petrol ürünleri hariç)"
49.41.05,"Kara yolu ile canlı hayvan taşımacılığı (çiftlik hayvanları, kümes hayvanları, vahşi hayvanlar vb.)"
49.41.06,"Sürücüsü ile birlikte kamyon, beton mikseri ve diğer motorlu yük taşıma araçlarının kiralanması"
49.41.08,"Kara yolu ile şehir içi yük taşımacılığı (gaz ve petrol ürünleri, kimyasal ürünler vb.)"
49.41.09,"Kara yolu ile şehirler arası yük taşımacılığı (gaz ve petrol ürünleri, kimyasal ürünler vb.)"
49.41.10,"Kara yolu ile uluslararası yük taşımacılığı (gaz ve petrol ürünleri, kimyasal ürünler vb.)"
49.41.11,Kara yolu ile çeşitli taşıma türüne uygun konteyner taşımacılığı
49.41.90,Kara yolu ile diğer yük taşımacılığı
49.42,Ev ve iş yerlerine verilen taşımacılık hizmetleri
49.42.01,Ev ve iş yerlerine verilen taşımacılık hizmetleri
49.5,Boru hattı taşımacılığı
49.50,Boru hattı taşımacılığı
49.50.01,"Boru hattı ile ham petrol, rafine petrol ve petrol ürünleri taşımacılığı"
49.50.03,Boru hattı pompa istasyonlarını işletme hizmetleri
49.50.04,Boru hattı ile doğal gaz taşımacılığı
49.50.90,"Boru hattı ile diğer malların taşımacılığı (kömür çamuru, kimyasal ürünler, vb, boru hattı pompa istasyonlarını işletme hizmetleri dahil)"
50,Su yolu taşımacılığı
50.1,Deniz ve kıyı sularında yolcu taşımacılığı
50.10,Deniz ve kıyı sularında yolcu taşımacılığı
50.10.12,Deniz ve kıyı sularında yolcu gemilerinin ve teknelerinin mürettebatıyla birlikte kiralanması (gezinti tekneleri dahil)
50.10.13,"Kıyı sularında yolcuların feribotlarla, kruvaziyer gemilerle ve teknelerle taşınması (deniz otobüsleri işletmeciliği dahil; uluslararası denizler ile göl ve nehirlerde yapılanlar hariç)"
50.10.14,Deniz ve kıyı sularında yat işletmeciliği
50.10.15,Deniz ve kıyı sularında gezi veya tur bot ve teknelerinin işletilmesi (yat işletmeciliği hariç)
50.10.16,Uluslararası denizlerde yolcuların gemilerle taşınması
50.10.90,Deniz ve kıyı sularında diğer yolcu taşımacılığı (deniz taksi vb. dahil)
50.2,Deniz ve kıyı sularında yük taşımacılığı
50.20,Deniz ve kıyı sularında yük taşımacılığı
50.20.17,"Uluslararası sularda ham petrolün, petrol ürünlerinin ve kimyasalların tanker gemilerle taşınması (gazlar hariç)"
50.20.18,Uluslararası sularda dökme kuru yük taşınması (kimyasalların taşınması hariç)
50.20.19,"Uluslararası sularda ve kabotaj hattında çekme ve itme hizmetleri (römorkaj) (mavnaların, petrol kulelerinin vb.nin taşınması) (iç sular hariç)"
50.20.20,Uluslararası sularda frigorifik gemilerle dondurulmuş veya soğutulmuş malların taşınması
50.20.21,Uluslararası sularda çoklu taşıma türüne uygun konteynerlerin konteyner gemileriyle taşınması
50.20.22,Uluslararası sularda ve kabotaj hattında yük taşımacılığı gemilerinin mürettebatıyla birlikte kiralanması (iç sular hariç)
50.20.23,"Uluslararası sularda diğer dökme sıvıların tanker gemilerle taşınması (ham petrolün, petrol ürünlerinin, gazların ve kimyasalların taşınması hariç)"
50.20.24,Uluslararası sularda gazların tanker gemilerle taşınması
50.20.25,"Kabotaj hattında ham petrolün, petrol ürünlerinin ve kimyasalların tanker gemilerle taşınması (gazlar hariç) (iç sular hariç)"
50.20.26,Kabotaj hattında dökme kuru yük taşınması (kimyasalların taşınması hariç) (iç sular hariç)
50.20.27,Kabotaj hattında frigorifik gemilerle dondurulmuş veya soğutulmuş malların taşınması (iç sular hariç)
50.20.28,Kabotaj hattında çoklu taşıma türüne uygun konteynerlerin konteyner gemileriyle taşınması (iç sular hariç)
50.20.29,"Kabotaj hattında diğer sıvıların tanker gemilerle taşınması (ham petrolün, petrol ürünlerinin, gazların ve kimyasalların taşınması hariç) (iç sular hariç)"
50.20.30,Kabotaj hattında gazların tanker gemilerle taşınması (iç sular hariç)
50.20.90,Uluslararası sularda yapılan diğer yük taşımacılığı 
50.20.91,Kabotaj hattında yapılan diğer yük taşımacılığı (iç sular hariç)
50.3,İç sularda yolcu taşımacılığı
50.30,İç sularda yolcu taşımacılığı
50.30.08,"İç sularda yolcu taşımacılığı (nehir, kanal ve göllerde yapılanlar, vb.) (gezinti amaçlı olanlar dahil)"
50.30.09,İç sularda yolcu taşıma gemilerinin ve teknelerinin mürettebatıyla birlikte kiralanması
50.4,İç sularda yük taşımacılığı
50.40,İç sularda yük taşımacılığı
50.40.05,"İç sularda yük taşımacılığı (nehir, kanal ve göllerde yapılanlar, vb.)"
50.40.07,"İç sularda yük taşıma gemi ve teknelerinin mürettebatıyla birlikte kiralanması hizmetleri (nehir, kanal ve göllerde, vb.)"
50.40.08,"İç sularda çekme ve itme hizmetleri (römorkaj) (mavnaların, şamandıraların vb.nin taşınması) (nehir, kanal, göl vb.)"
51,Hava yolu taşımacılığı
51.1,Hava yolu ile yolcu taşımacılığı
51.10,Hava yolu ile yolcu taşımacılığı
51.10.01,Hava yolu yolcu taşımacılığı (tarifeli olanlar)
51.10.02,Hava yolu yolcu taşımacılığı (turistik ve gezi amaçlı olanlar ile tarifesiz olanlar) (hava taksi taşımacılığı dahil)
51.10.03,Hava yolu yolcu taşıma araçlarının mürettebatıyla birlikte kiralanması
51.2,Hava yolu ile yük taşımacılığı ve uzay taşımacılığı
51.21,Hava yolu ile yük taşımacılığı
51.21.17,Hava yolu ile yük taşımacılığı
51.22,Uzay taşımacılığı
51.22.02,Uzay taşımacılığı
52,"Depolama, ambarlama ve taşımacılık için destekleyici faaliyetler"
52.1,Depolama ve ambarlama
52.10,Depolama ve ambarlama
52.10.02,Frigorifik depolama ve antrepoculuk faaliyetleri (bozulabilir gıda ürünleri dahil dondurulmuş veya soğutulmuş mallar için depolama)
52.10.03,Hububat depolama ve antrepoculuk faaliyetleri (hububat silolarının işletilmesi vb.)
52.10.04,"Petrol, petrol ürünleri, kimyasallar vb. depolama ve antrepoculuk faaliyetleri(gaz hariç)"
52.10.05,"Dökme sıvı depolama ve antrepoculuk faaliyetleri (yağ, şarap vb. dahil; petrol, petrol ürünleri, kimyasallar, gaz vb. hariç)"
52.10.90,"Diğer depolama ve antrepoculuk faaliyetleri (frigorifik depolar ile hububat, kimyasallar, dökme sıvı ve gaz depolama faaliyetleri hariç)"
52.2,Taşımacılık için destekleyici faaliyetler
52.21,Kara taşımacılığını destekleyici hizmet faaliyetleri
52.21.04,Kara yolu taşımacılığı ile ilgili özel ve ticari araçlar için çekme ve yol yardımı faaliyetleri
52.21.05,"Demir yolu taşımacılığını destekleyici faaliyetler (demir yolu çekme ve itme hizmetleri, manevra ve makas değiştirme hizmetleri, demir yolu terminal hizmetleri vb. dahil, emanetçilik hariç)"
52.21.06,Kara taşımacılığına yönelik emanet büroları işletmeciliği (demir yollarında yapılanlar dahil)
52.21.07,Otopark ve garaj işletmeciliği (bisiklet parkları ve karavanların kışın saklanması dahil)
52.21.08,"Otoyol, tünel ve köprü işletmeciliği"
52.21.09,Kara yolu yolcu taşımacılığına yönelik otobüs terminal hizmetleri
52.21.10,"Kara yolu yolcu taşımacılığına yönelik otobüs, minibüs ve taksi duraklarının işletilmesi (otobüs terminal hizmetleri hariç)"
52.21.12,Kara taşımacılığını destekleyici olarak gazların sıvılaştırılması
52.21.13,Yolcu taşımacılığı kooperatiflerinin faaliyetleri
52.21.90,Kara taşımacılığını destekleyici diğer hizmetler (kamyon terminal işletmeciliği dahil)
52.22,Su yolu taşımacılığını destekleyici hizmet faaliyetleri
52.22.06,"Su yolu taşımacılığını destekleyici olarak liman ve su yollarının işletilmesi (limanların, iskelelerin, rıhtımların, su yolu havuzlarının, deniz terminallerinin vb. işletilmesi) (deniz feneri, fener dubası vb. işletilmesi hariç)"
52.22.07,"Su yolu taşımacılığını destekleyici olarak deniz feneri, fener dubası, fener gemisi, şamandıra, kanal işaretleri vb. seyir yardımcıları ile verilen hizmet faaliyetleri"
52.22.08,Deniz ve kıyı suları ile iç sularda kılavuzluk ve rıhtıma yanaştırma faaliyetleri (geminin havuzlanması ve havuzdan çıkarılması dahil)
52.22.10,"Deniz ve kıyı suları ile iç sularda gemi kurtarma ve tekrar yüzdürme faaliyetleri (zor durumdaki gemilerin çekilmesi, bu gemilerin ve kargolarının kurtarılması vb.)"
52.22.90,"Su taşımacılığını destekleyici diğer hizmetler (Su yolu taşımacılığını destekleyici olarak deniz feneri, fener dubası, fener gemisi, şamandıra, kanal işaretleri vb. seyir yardımcıları ile verilen hizmet faaliyetleri dahil)"
52.23,Hava yolu taşımacılığını destekleyici hizmet faaliyetleri
52.23.03,Havaalanı yer hizmet faaliyetleri (kargo ve bagaj yükleme boşaltma hizmetleri hariç)
52.23.04,"Havaalanı işletmeciliği (uçak pisti işletme, yolcu terminali ve havayolu şirketlerinin kendi bilet satış hizmetleri dahil; havaalanı yer hizmetleri ve bilet acentelerinin faaliyetleri hariç)"
52.23.06,Hava trafik kontrol hizmetleri (havaalanında yer alan kule ve radar istasyonları tarafından sağlanan hizmetler dahil)
52.23.07,Uzay taşımacılığını destekleyici hizmetler
52.23.90,"Hava taşımacılığını destekleyici diğer faaliyetler (havaalanlarında yangın söndürme ve yangın önleme faaliyetleri, hava taşıtlarının çekilmesi, vb.)"
52.24,Kargo yükleme boşaltma (elleçleme) hizmetleri
52.24.08,Su yolu taşımacılığıyla ilgili kargo ve bagaj yükleme boşaltma (elleçleme) hizmetleri
52.24.09,Hava yolu taşımacılığıyla ilgili kargo ve bagaj yükleme boşaltma (elleçleme) hizmetleri
52.24.10,Kara yolu taşımacılığıyla ilgili kargo yükleme boşaltma (elleçleme) hizmetleri
52.24.11,Demir yolu taşımacılığıyla ilgili kargo yükleme boşaltma (elleçleme) hizmetleri
52.24.90,Diğer kargo yükleme boşaltma (elleçleme) hizmetleri
52.25,Lojistik hizmet faaliyetleri
52.25.01,"Taşınan malların kasalardan, sandıklardan vb.lerinden çıkarılması, numune alınması, incelenmesi vb. faaliyetler"
52.25.99,"Başka yerde sınıflandırılmamış taşımacılığı destekleyici diğer faaliyetler (grup sevkiyatının organizasyonu, malların taşınması sırasında korunması için geçici olarak kasalara vb. yerleştirilmesi, yüklerin birleştirilmesi, gruplanması ve parçalara ayırılması, vb. dahil)"
52.26,Taşımacılığa yönelik diğer destekleyici faaliyetler
52.26.01,Uluslararası deniz yolu yük nakliyat acentelerinin faaliyetleri
52.26.02,Kabotaj hattı deniz yolu yük nakliyat acentelerinin faaliyetleri
52.26.03,Kara yolu yük nakliyat acentelerinin faaliyetleri
52.26.04,Hava yolu yük nakliyat acentelerinin faaliyetleri
52.26.05,Demir yolu yük nakliyat acentelerinin faaliyetleri
52.26.06,Yük taşımacılığı kooperatiflerinin faaliyetleri
52.26.07,Yetkili gümrük müşavirliği veya gümrük müşavirliği
52.26.08,Gümrük komisyoncularının faaliyetleri
52.26.09,Taşıma belgelerinin ve irsaliyelerin düzenlenmesi ve tedarik edilmesi
52.26.99,Başka yerde sınıflandırılmamış taşımacılığa yönelik diğer destekleyici faaliyetler
52.3,Taşımacılık için aracılık hizmeti faaliyetleri
52.31,Yük taşımacılığına yönelik aracılık hizmeti faaliyetleri
52.31.01,Deniz yolu yük nakliyat komisyoncuları ve brokerlerinin faaliyetleri
52.31.02,Kara yolu yük nakliyat komisyoncularının faaliyetleri
52.31.03,Hava yolu yük nakliyat komisyoncularının faaliyetleri
52.31.04,Demir yolu yük nakliyat komisyoncularının faaliyetleri
52.32,Yolcu taşımacılığına yönelik aracılık hizmeti faaliyetleri
52.32.00,Yolcu taşımacılığına yönelik aracılık hizmeti faaliyetleri
53,Posta ve kurye faaliyetleri
53.1,Evrensel hizmet yükümlülüğü altında postacılık faaliyetleri
53.10,Evrensel hizmet yükümlülüğü altında postacılık faaliyetleri
53.10.01,Evrensel hizmet yükümlülüğü altında postacılık faaliyetleri (kargo ve kurye şirketlerinin faaliyetleri hariç)
53.2,Diğer posta ve kurye faaliyetleri
53.20,Diğer posta ve kurye faaliyetleri
53.20.08,Gıda dağıtım faaliyetleri
53.20.09,"Kurye faaliyetleri (kara, deniz ve hava yolu ile yapılanlar dahil; evrensel hizmet yükümlülüğü altında postacılık ile gıda dağıtım faaliyetleri hariç)"
53.20.10,"Paket ve koli gibi kargoların toplanması, sınıflandırılması, taşınması ve dağıtımı faaliyetleri (dökme yükler ve evrensel hizmet yükümlülüğü altında postacılık faaliyetleri hariç)"
53.3,Posta ve kurye faaliyetlerine yönelik aracılık hizmeti faaliyetleri
53.30,Posta ve kurye faaliyetlerine yönelik aracılık hizmeti faaliyetleri
53.30.00,Posta ve kurye faaliyetlerine yönelik aracılık hizmeti faaliyetleri
I,KONAKLAMA VE YİYECEK HİZMETİ FAALİYETLERİ
55,Konaklama
55.1,Oteller ve benzeri konaklama yerleri
55.10,Oteller ve benzeri konaklama yerleri
55.10.02,Otel vb. konaklama yerlerinin faaliyetleri (günlük temizlik ve yatak yapma hizmeti sağlanan yerlerin faaliyetleri) (kendi müşterilerine restoran hizmeti vermeyenler ile devre mülkler hariç)
55.10.05,Otel vb. konaklama yerlerinin faaliyetleri (günlük temizlik ve yatak yapma hizmeti sağlanan yerlerin faaliyetleri) (kendi müşterilerine restoran hizmeti verenler ile devre mülkler hariç)
55.2,Tatil ve diğer kısa süreli konaklama yerleri
55.20,Tatil ve diğer kısa süreli konaklama yerleri
55.20.01,Tatil ve diğer kısa süreli konaklama faaliyetleri (günlük temizlik ve yatak yapma hizmeti sağlanan oda veya süit konaklama faaliyetleri hariç)
55.20.03,Kendine ait veya kiralanmış mobilyalı evlerde bir aydan daha kısa süreli olarak konaklama faaliyetleri
55.20.04,Tatil amaçlı pansiyonların faaliyetleri
55.3,Kamp alanları ve karavan parkları
55.30,Kamp alanları ve karavan parkları
55.30.36,Kamp alanları ve karavan parkları
55.4,Konaklama için aracılık hizmeti faaliyetleri
55.40,Konaklama için aracılık hizmeti faaliyetleri
55.40.00,Konaklama için aracılık hizmeti faaliyetleri
55.9,Diğer konaklama yerleri
55.90,Diğer konaklama yerleri
55.90.01,"Öğrenci ve işçi yurtları, pansiyonlar ve odası kiralanan evlerde yapılan konaklama faaliyetleri (tatil amaçlı olanlar hariç)"
55.90.02,"Misafirhaneler, ordu evi, polis evi ve öğretmen evleri ile eğitim ve dinlenme tesisleri gibi konaklama yerlerinin faaliyetleri"
55.90.04,Evlerde ve mobilyalı veya mobilyasız dairelerde veya apartmanlarda bir yıldan daha kısa bir süre için konaklama hizmeti sağlanması faaliyetleri
55.90.90,"Diğer konaklama yerlerinin faaliyetleri (başka bir birim tarafından işletildiğinde yataklı vagonlar vb. dahil; misafirhaneler, öğretmen evi vb. hariç)"
56,Yiyecek ve içecek hizmeti faaliyetleri
56.1,Lokantalar ve seyyar yemek hizmeti faaliyetleri
